{"schema":"mana.inspect.work-items/v1","work_items":[{"work_item_id":"feature:PROJ-24342","work_item_type":"feature","external_ticket_id":{"value":"PROJ-24342","provenance":"explicit_workspace_manifest"},"title":{"value":null,"provenance":"unavailable"},"purpose":{"value":"story-delivery","provenance":"explicit_workspace_manifest"},"branch":{"value":"feature/payment","provenance":"explicit_workspace_manifest"},"canonical_branch":false,"lifecycle":{"state":"in_progress","provenance":"canonical_path","coverage":"canonical_artifact_presence"},"review":{"state":"unknown","provenance":"unavailable","coverage":"unknown"},"attention_items":[{"id":"review-needed","category":"review_required","severity":"warning","work_item_id":"feature:PROJ-24342","label":"Review required","next_action":null,"related_artifact_ids":[],"provenance":"explicit_workspace_manifest"}],"artifacts":[{"artifact_id":"file:.mana/features/PROJ-24342/manifest.yaml","path":".mana/features/PROJ-24342/manifest.yaml","kind":"workspace_manifest","status":"available","work_item_id":"feature:PROJ-24342","section_id":"artifacts","label":"Workspace manifest"}]}],"coverage":"canonical_workspace_manifests","diagnostics":[],"guarantees":{"model_calls":0,"writes":false,"semantic_inference":"canonical_structured_sources_only"}}
